IMPERATOR T CAESAR AVGVSTI E,imperator titvs caesar avgvsti filivs
IMPERATOR T CAESAR AVGVSTI F,imperator titvs caesar avgvsti filivs
ION MAX TR P COS V,pontifex maximvs tribvnicia potestate consvl Ⅴ
T ELAVI VESPASIANVS CAESAR,titvs flavivs vespasianvs caesar
TR PON P P S S C,tribvnicia potestate pater patriae semis senatvs consvlto
CAE DVM ET TI CAES IMP VESPAS,caesar domitianvs et titvs caesar imperator vespasianvs
SACERDOS DIVI AVGVSTI,sacerdos divi avgvsti
PROPRA AFRICA,propraetor africae
PROPRAE AFRICAE,propraetor africae
