AT,
AVGVR PONTIF,
AVGVST DIVI F LVDOS SAE,
C RVBELLIVS BLANDUS,
CA,
CAESAR DIVI F ARMINIA CAPTA,
CAISAR,
COL NIM,
COS IMP CAESAR AVGV XI,
COS IMP CAESAR AVGVS XI,
COSSVS CN F LENTVLVS,
COSSVS LENTVLVS RES PVB AVGVST,
FORT RED CAES AVG S P Q R,
FORTVN REDV CAESARI AVG S P Q R,
FORTVN REDVC CAESARI AVG S P Q R,
GERMANVS INDVTILLI F,
IMP CAESAR DIVI F COS VI LIBERTATIS P R VINDEX,
L AQVILLIVS FLORVS III VIR SICIL,
L MESCINIVS AVG SVF P,
QVOD VIAE MVN SVNT,
S P Q R  CL V,
S P Q R  IMP CAESARI AVG COS XI TRI POT VI,
S P R SIGNIS RECEPTIS,
SC,
VOT P SVSC PRO SAL ET RED I O M SACR,
VOT P SVSC PRO SALVT ET RED I O M SACR,
