ADLOCVT COH,
AGRIPPINA DRVSILLA IVLIA S C,
AGRIPPINA M F MAT C CAESARIS AVGVSTI,
AGRIPPINA MAT C CAES AVG GERM,
ARTAXIAS GERMANICVS,
C CAESAR AVG GERM P M TR POT,
C CAESAR AVG GERM P M TR POT COS,
C CAESAR AVG GERMANICVS,
C CAESAR AVG GERMANICVS P M TR POT PIETAS,
C CAESAR AVG GERMANICVS PON M TR POT,
C CAESAR AVG PON M TR POT III COS III,
C CAESAR AVG PON M TR POT IIII COS IIII,
C CAESAR DIVI AVG PRON AVG,
C CAESAR DIVI AVG PRON AVG P M TR P III P P,
C CAESAR DIVI AVG PRON AVG P M TR P IIII P P,
C CAESAR DIVI AVG PRON AVG P M TR P IIII P P PIETAS,
C CAESAR DIVI AVG PRON AVG P M TR POT III P P,
C CAESAR DIVI AVG PRON AVG P M TR POT III PP,
CONSENSV SENAT ET EQ ORDIN P Q R,
DIVO AVG S C,
DIVVS AVG PATER PATRIAE,
DIVVS AVGVSTVS,
DIVVS AVGVSTVS S C,
GERMANICVS CAES P C CAES AVG GERM,
GERMANICVS CAESAR,
GERMANICVS CAESAR TI AVG F COS II,
GERMANICVS CAESAR TI AVGVST F DIVI AVG N,
IMPERATOR PONT MAX AVG TR POT,
NERO ET DRVSVS CAESARES,
PM TR POT COS,
PM TR POT IIII,
PM TR POT ITER,
PON M TR P III P P COS DES III,
PON M TR P III P P COS TERT,
PON M TR P IIII P P COS TERT,
S P Q R  MEMORIAE AGRIPPINAE,
S P Q R  P P OB CIVES SERVATOS,
S P Q R  PP OB CS,
SIGNIS RECEPT DEVICTIS GERM S C,
